{
  "schema_version": 1,
  "company": {
    "name": "Llobregat Express",
    "legal_name": "Llobregat Express Logística, S.L.",
    "founded_year": 2014,
    "headquarters_municipality": "Barcelona",
    "business_model": "Regional last-mile parcel carrier that receives parcels from e-commerce shippers, local fulfilment centres and partner carriers at a single cross-dock in the Zona Franca and delivers them across Barcelona and the lower Llobregat area: same day for shipments registered before 11:00, next day otherwise. It charges shippers per parcel by size and service level, and also works as the final-mile subcontractor for national networks that have no fleet of their own in Barcelona.",
    "modeled_on": "It works like the Barcelona metropolitan branch of a Spanish national parcel network such as SEUR, MRW, GLS or Correos Express. Overnight linehaul trucks feed one cross-dock, parcels are sorted by delivery zone before dawn, and salaried drivers run fixed zone routes in the morning, with a second afternoon wave for same-day e-commerce. Unlike those networks it has no national coverage of its own: it only delivers in the Barcelona area and takes parcels from shippers and partner carriers.",
    "customer_segments": [
      "E-commerce retailers (fashion, electronics, home goods) shipping to consumers in the Barcelona metropolitan area",
      "Marketplace sellers and local online shops buying same-day delivery",
      "National parcel networks and couriers subcontracting final-mile delivery in Barcelona",
      "Pharmacies and healthcare distributors (ambient-temperature goods only)",
      "Retail chains and independent shops in Ciutat Vella, Eixample and Gràcia (store replenishment and supplies)",
      "Offices and professional services in the 22@, Diagonal and Gran Via L'Hospitalet business districts",
      "Industrial and spare-parts distributors in the Zona Franca, El Prat, Cornellà and Sant Boi industrial estates"
    ]
  },
  "hub": {
    "name": "Llobregat Express Hub Zona Franca (BCN-ZF)",
    "address": "Carrer 4, 18-24, Sector C, Polígon Industrial de la Zona Franca, 08040 Barcelona",
    "municipality": "Barcelona",
    "lat": 41.3395,
    "lon": 2.1365,
    "floor_area_m2": 7500,
    "loading_docks": 36,
    "sorting_capacity_parcels_per_hour": 2500,
    "timetable": {
      "inbound_trucks_arrive": "02:30-12:30",
      "sorting": "03:00-14:00",
      "first_departure": "07:30",
      "last_departure": "14:45",
      "same_day_cutoff": "11:00"
    }
  },
  "service_promise": {
    "delivery_windows": [
      {"name": "Morning wave (next-day B2C and B2B)", "start": "08:00", "end": "14:00"},
      {"name": "Afternoon-evening wave (same-day and evening B2C)", "start": "15:00", "end": "21:00"}
    ],
    "promised_window_minutes": 120,
    "on_time_target_pct": 95.0,
    "first_attempt_success_target_pct": 92.0,
    "failed_delivery_policy": "On a failed B2C attempt the driver leaves the parcel with a neighbour or building concierge only if the recipient authorised it in advance. Otherwise the recipient gets an SMS and e-mail notice (plus a card at the door) and the parcel returns to the hub. The recipient can book a free second attempt on the next working day in either window, or redirect the parcel to a partner pick-up point or locker. After a second failed attempt the parcel is held at the nearest pick-up point for 7 calendar days and then returned to the shipper. When a B2B recipient is found closed, the parcel is re-attempted automatically on the next morning's route."
  },
  "daily_volume": {
    "weekday_parcels_mean": 3500,
    "weekday_parcels_stddev": 350,
    "saturday_parcels_mean": 1050,
    "sunday_operates": false,
    "seasonal_peaks": [
      {"name": "Black Friday and Cyber Monday week", "month": 11, "multiplier": 1.55},
      {"name": "Christmas gift season", "month": 12, "multiplier": 1.4},
      {"name": "Three Kings (Reis) gifts and January sales returns", "month": 1, "multiplier": 1.2},
      {"name": "Back to school (tornada a l'escola)", "month": 9, "multiplier": 1.1}
    ],
    "parcel_mix": {"small_pct": 58.0, "medium_pct": 30.0, "large_pct": 12.0},
    "b2b_share_pct": 32.0
  },
  "zones": [
    {
      "zone_id": "Z01",
      "name": "Ciutat Vella",
      "municipality": "Barcelona",
      "districts": ["Ciutat Vella"],
      "centroid": {"lat": 41.3822, "lon": 2.1755},
      "distance_from_hub_km": 7.5,
      "share_of_daily_parcels": 0.06,
      "stops_per_route": 55,
      "minutes_per_stop": 4.6,
      "delivery_difficulty": "high",
      "difficulty_factors": [
        "Medieval street pattern in the Gòtic, Born and Raval: lanes 3-5 m wide where a van cannot enter or turn, so most stops are walked with a hand trolley 150-400 m from the vehicle",
        "Camera-controlled restricted-access areas for non-resident vehicles in the Gòtic, Born and Barceloneta; registered goods vehicles may enter only in a morning loading slot (roughly until 11:00), so later stops are done entirely on foot",
        "Large pedestrian streets (Portal de l'Àngel, Portaferrissa, the streets off La Rambla) and dense tourist crowds slow trolley walks all day",
        "Perimeter DUM bays on Via Laietana, Ronda de Sant Pau, Paral·lel and Passeig de Colom are full from about 09:00; stays are limited to 30 minutes and must be registered in the areaDUM app",
        "Old walk-up buildings without lifts or concierges, and many tourist flats with no one to receive, push up failed first attempts",
        "Shops, bars and hotels open between 09:30 and 10:30, so B2B stops bunch up in the late morning"
      ],
      "preferred_vehicle_type_ids": ["EV-Q", "EV-S"]
    },
    {
      "zone_id": "Z02",
      "name": "Eixample",
      "municipality": "Barcelona",
      "districts": ["Eixample"],
      "centroid": {"lat": 41.3910, "lon": 2.1630},
      "distance_from_hub_km": 8.0,
      "share_of_daily_parcels": 0.17,
      "stops_per_route": 78,
      "minutes_per_stop": 3.0,
      "delivery_difficulty": "medium",
      "difficulty_factors": [
        "Regular Cerdà grid with chamfered corners (xamfrans) where most DUM bays sit: stop sequencing is predictable and one parking often serves 3-5 addresses",
        "Superilla Barcelona green axes (Consell de Cent, Rocafort, Comte Borrell, Girona) and the Sant Antoni superblock: through traffic removed, 10 km/h limit, forced loops and loading only at designated bays",
        "Heavy congestion on Aragó, Gran Via, Diagonal, Balmes and Passeig de Sant Joan at peak hours; stopping in bus and bike lanes is fined",
        "DUM bays limited to 30 minutes through the areaDUM app; some chamfer bays are loading-only in the morning and revert to resident parking later, so afternoon stops take longer",
        "Many buildings have a concierge (porter) who accepts parcels in the morning, which raises first-attempt success",
        "Dense mix of shops, offices and flats gives several parcels per stop, but many shops only receive goods between 10:00 and 13:30"
      ],
      "preferred_vehicle_type_ids": ["EV-M", "EV-S"]
    },
    {
      "zone_id": "Z03",
      "name": "Sants-Montjuïc",
      "municipality": "Barcelona",
      "districts": ["Sants-Montjuïc"],
      "centroid": {"lat": 41.3718, "lon": 2.1415},
      "distance_from_hub_km": 4.8,
      "share_of_daily_parcels": 0.08,
      "stops_per_route": 80,
      "minutes_per_stop": 3.0,
      "delivery_difficulty": "medium",
      "difficulty_factors": [
        "Nearest city district to the hub (La Marina borders the Zona Franca), so the drive to the first stop takes only 10-15 minutes",
        "Sants, Hostafrancs and La Bordeta: dense blocks with narrow side streets; Carrer de Sants and Creu Coberta form a busy bus-and-taxi shopping street with few places to stop",
        "Poble-sec climbs the slope of Montjuïc: steep streets and public stairways in the upper part, and very few DUM bays",
        "Trade fairs at Fira Montjuïc and concerts and sports events at the Olympic Stadium and Palau Sant Jordi close streets around Plaça d'Espanya",
        "La Marina del Prat Vermell: new developments with wide streets and easy parking"
      ],
      "preferred_vehicle_type_ids": ["EV-M", "EV-L"]
    },
    {
      "zone_id": "Z04",
      "name": "Les Corts",
      "municipality": "Barcelona",
      "districts": ["Les Corts"],
      "centroid": {"lat": 41.3860, "lon": 2.1300},
      "distance_from_hub_km": 7.0,
      "share_of_daily_parcels": 0.05,
      "stops_per_route": 84,
      "minutes_per_stop": 2.8,
      "delivery_difficulty": "low",
      "difficulty_factors": [
        "Wide avenues (Diagonal, Travessera de les Corts, Numància, Joan Güell) and modern blocks with loading access and concierge desks",
        "Diagonal office and retail cluster around L'Illa: mailrooms take large multi-parcel B2B deliveries",
        "Pedralbes and the university area: low-density housing and campuses with gatehouses, so walks are longer and there are access checks",
        "Match and event days at the Camp Nou close nearby streets and jam Travessera de les Corts and Arístides Maillol",
        "Good DUM coverage along the Travessera de les Corts shopping street"
      ],
      "preferred_vehicle_type_ids": ["EV-L", "EV-M"]
    },
    {
      "zone_id": "Z05",
      "name": "Sarrià-Sant Gervasi",
      "municipality": "Barcelona",
      "districts": ["Sarrià-Sant Gervasi"],
      "centroid": {"lat": 41.4005, "lon": 2.1345},
      "distance_from_hub_km": 9.5,
      "share_of_daily_parcels": 0.07,
      "stops_per_route": 64,
      "minutes_per_stop": 3.5,
      "delivery_difficulty": "high",
      "difficulty_factors": [
        "Steep streets above Via Augusta (Bonanova, Putxet, Sant Gervasi, Tres Torres) with gradients over 10%: frequent hill starts and slow trolley work",
        "Detached houses and gated blocks with intercoms and front gardens: long walks from van to door and more recipients not at home",